{"$schema":"https://json-schema.org/draft/2020-12/schema","$id":"https://kaveep.dev/dev-agent/schemas/sandbox-edit-result.schema.json","title":"KAVEEP DEV-AGENT Sandbox Edit Result","type":"object","required":["sandboxEditResultId","schemaVersion","sandboxId","status","startedAt","completedAt","changeSet","diff","warnings","errors","limitations","sourceRepositoryModified","recommendedNextAction"],"properties":{"sandboxEditResultId":{"type":"string","pattern":"^sandbox_edit_result_[A-Za-z0-9][A-Za-z0-9_-]*$"},"schemaVersion":{"const":"1.0.0"},"sandboxId":{"type":"string","pattern":"^sandbox_[A-Za-z0-9][A-Za-z0-9_-]*$"},"status":{"enum":["completed","completed_with_warnings","blocked","failed"]},"startedAt":{"type":"string","format":"date-time"},"completedAt":{"type":"string","format":"date-time"},"changeSet":{"$ref":"sandbox-change.schema.json"},"diff":{"$ref":"sandbox-diff.schema.json"},"warnings":{"type":"array","items":{"$ref":"sandbox-manifest.schema.json#/$defs/message"}},"errors":{"type":"array","items":{"$ref":"sandbox-manifest.schema.json#/$defs/message"}},"limitations":{"type":"array","items":{"type":"string"}},"sourceRepositoryModified":{"const":false},"recommendedNextAction":{"enum":["validate_changes","review_changes","block_request"]}},"additionalProperties":false}
