{"sandboxEditResultId":"sandbox_edit_result_example_001","schemaVersion":"1.0.0","sandboxId":"sandbox_example_001","status":"completed","startedAt":"1970-01-01T00:00:00.000Z","completedAt":"1970-01-01T00:00:00.000Z","changeSet":{"changeSetId":"change_set_example_001","schemaVersion":"1.0.0","sandboxId":"sandbox_example_001","createdAt":"1970-01-01T00:00:00.000Z","changes":[{"sequence":1,"operation":"create","relativePath":"notes.txt","resultingPath":"notes.txt","beforeHash":"e3b0c44298fc1c149afbf4c8996fb92427ae41e4649b934ca495991b7852b855","afterHash":"2cf24dba5fb0a30e26e83b2ac5b9e29e1b161e5c1fa7425e73043362938b9824","beforeBytes":0,"afterBytes":5,"timestamp":"1970-01-01T00:00:00.000Z","evidenceRef":"evidence_sandbox_edit_example_001","rollback":{"operation":"delete","path":"notes.txt"}}],"evidenceRefs":[{"evidenceId":"evidence_sandbox_edit_example_001","evidenceType":"sandbox_file_edit","verificationStatus":"verified","sourceType":"system_observation","createdAt":"1970-01-01T00:00:00.000Z","summary":"create notes.txt"}],"warnings":[],"rollbackReady":true,"sourceRepositoryModified":false},"diff":{"sandboxId":"sandbox_example_001","filesAdded":["notes.txt"],"filesModified":[],"filesDeleted":[],"bytesChanged":5,"warnings":[],"limitations":["Diff is a deterministic file summary, not a Git diff."]},"warnings":[],"errors":[],"limitations":["Sandbox-only editing."],"sourceRepositoryModified":false,"recommendedNextAction":"validate_changes"}
